{"contract_name":"canon_proposal","contract_version":1,"draft":{"draft_id":"draft_alpha","authority":"draft","source_set_digest":"aaaaaaaaaaaaaaaaaaaaaaaaaaaaaaaaaaaaaaaaaaaaaaaaaaaaaaaaaaaaaaaa","content_digest":"bbbbbbbbbbbbbbbbbbbbbbbbbbbbbbbbbbbbbbbbbbbbbbbbbbbbbbbbbbbbbbbb"},"proposal":{"proposal_id":"proposal_alpha","proposal_version":2,"status":"needs_review","campaign_id":"campaign_alpha","base_revision":"revision_12","source_revision":"revision_12","diff_digest":"cccccccccccccccccccccccccccccccccccccccccccccccccccccccccccccccc","changes":[{"change_id":"change_one","subject_id":"entity_station","change_type":"authority_transition","from_authority":"preparation","to_authority":"canon","content_digest":"dddddddddddddddddddddddddddddddddddddddddddddddddddddddddddddddd"}],"correction_of_version":1},"validation":{"status":"passed","validation_digest":"eeeeeeeeeeeeeeeeeeeeeeeeeeeeeeeeeeeeeeeeeeeeeeeeeeeeeeeeeeeeeeee","error_count":0},"approval_binding":null}
